<?xml version="1.0" encoding="UTF-8"?>
<wit:tuning xmlns:wit="http://www.wwidesigner.com/Tuning"
	xmlns:xsi="http://www.w3.org/2001/XMLSchema-instance"
	xsi:schemaLocation="http://www.wwidesigner.com/Tuning ../../../../../main/com/wwidesigner/note/bind/Tuning.xsd ">
	<name>6 hole NAF1 tuning</name>
	<comment>Tuning for 6HoleNAF1.xml</comment>
	<numberOfHoles>6</numberOfHoles>
	<fingering>
		<note>
			<name>A4</name>
			<frequency>440</frequency>
		</note>
		<openHole>false</openHole>
		<openHole>false</openHole>
		<openHole>false</openHole>
		<openHole>false</openHole>
		<openHole>false</openHole>
		<openHole>false</openHole>
	</fingering>
	<fingering>
		<note>
			<name>C5</name>
			<frequency>523.25</frequency>
		</note>
		<openHole>false</openHole>
		<openHole>false</openHole>
		<openHole>false</openHole>
		<openHole>false</openHole>
		<openHole>false</openHole>
		<openHole>true</openHole>
	</fingering>
	<fingering>
		<note>
			<name>C#5</name>
			<frequency>554.37</frequency>
		</note>
		<openHole>false</openHole>
		<openHole>false</openHole>
		<openHole>false</openHole>
		<openHole>false</openHole>
		<openHole>true</openHole>
		<openHole>false</openHole>
	</fingering>
	<fingering>
		<note>
			<name>D5</name>
			<frequency>587.33</frequency>
		</note>
		<openHole>false</openHole>
		<openHole>false</openHole>
		<openHole>false</openHole>
		<openHole>false</openHole>
		<openHole>true</openHole>
		<openHole>true</openHole>
	</fingering>
	<fingering>
		<note>
			<name>D#5</name>
			<frequency>622.25</frequency>
		</note>
		<openHole>false</openHole>
		<openHole>false</openHole>
		<openHole>false</openHole>
		<openHole>true</openHole>
		<openHole>false</openHole>
		<openHole>true</openHole>
	</fingering>
	<fingering>
		<note>
			<name>E5</name>
			<frequency>659.26</frequency>
		</note>
		<openHole>false</openHole>
		<openHole>false</openHole>
		<openHole>false</openHole>
		<openHole>true</openHole>
		<openHole>true</openHole>
		<openHole>true</openHole>
	</fingering>
	<fingering>
		<note>
			<name>F5</name>
			<frequency>698.46</frequency>
		</note>
		<openHole>false</openHole>
		<openHole>false</openHole>
		<openHole>true</openHole>
		<openHole>false</openHole>
		<openHole>true</openHole>
		<openHole>true</openHole>
	</fingering>
	<fingering>
		<note>
			<name>F#5</name>
			<frequency>739.99</frequency>
		</note>
		<openHole>false</openHole>
		<openHole>false</openHole>
		<openHole>true</openHole>
		<openHole>true</openHole>
		<openHole>true</openHole>
		<openHole>true</openHole>
	</fingering>
	<fingering>
		<note>
			<name>G5</name>
			<frequency>783.99</frequency>
		</note>
		<openHole>false</openHole>
		<openHole>true</openHole>
		<openHole>false</openHole>
		<openHole>true</openHole>
		<openHole>true</openHole>
		<openHole>true</openHole>
	</fingering>
	<fingering>
		<note>
			<name>G#5</name>
			<frequency>830.61</frequency>
		</note>
		<openHole>false</openHole>
		<openHole>true</openHole>
		<openHole>true</openHole>
		<openHole>true</openHole>
		<openHole>true</openHole>
		<openHole>true</openHole>
	</fingering>
	<fingering>
		<note>
			<name>A5</name>
			<frequency>880</frequency>
		</note>
		<openHole>true</openHole>
		<openHole>true</openHole>
		<openHole>false</openHole>
		<openHole>true</openHole>
		<openHole>true</openHole>
		<openHole>true</openHole>
	</fingering>
<!-- 	<fingering>
		<note>
			<name>A#5</name>
			<frequency>932.33</frequency>
		</note>
		<openHole>false</openHole>
		<openHole>true</openHole>
		<openHole>false</openHole>
		<openHole>false</openHole>
		<openHole>false</openHole>
		<openHole>false</openHole>
	</fingering> -->
	<fingering>
		<note>
			<name>B5</name>
			<frequency>987.77</frequency>
		</note>
		<openHole>true</openHole>
		<openHole>true</openHole>
		<openHole>false</openHole>
		<openHole>false</openHole>
		<openHole>false</openHole>
		<openHole>false</openHole>
	</fingering>
	<fingering>
		<note>
			<name>C6</name>
			<frequency>1046.5</frequency>
		</note>
		<openHole>true</openHole>
		<openHole>true</openHole>
		<openHole>false</openHole>
		<openHole>false</openHole>
		<openHole>false</openHole>
		<openHole>true</openHole>
	</fingering>
</wit:tuning>
