<?xml version="1.0" encoding="UTF-8"?>
<wit:tuning xmlns:wit="http://www.wwidesigner.com/Tuning"
	xmlns:xsi="http://www.w3.org/2001/XMLSchema-instance"
	xsi:schemaLocation="http://www.wwidesigner.com/Tuning ../../../../../main/com/wwidesigner/note/bind/Tuning.xsd ">
	<name>Ken Light G, 6 hole NAF tuning</name>
	<comment>Tuning for Ken Light PVC G, standard fingering. Tuning done at 74.0 F.</comment>
	<numberOfHoles>6</numberOfHoles>
	<fingering>
		<note>
			<name>G4</name>
			<frequency>393.13</frequency>
			<frequencyMin>372.14</frequencyMin>
			<frequencyMax>396.55</frequencyMax>
		</note>
		<openHole>false</openHole>
		<openHole>false</openHole>
		<openHole>false</openHole>
		<openHole>false</openHole>
		<openHole>false</openHole>
		<openHole>false</openHole>
	</fingering>
	<fingering>
		<note>
			<name>A#4</name>
			<frequency>466.7</frequency>
			<frequencyMin>442.55</frequencyMin>
			<frequencyMax>482.6</frequencyMax>
		</note>
		<openHole>false</openHole>
		<openHole>false</openHole>
		<openHole>false</openHole>
		<openHole>false</openHole>
		<openHole>false</openHole>
		<openHole>true</openHole>
	</fingering>
	<fingering>
		<note>
			<name>B4</name>
			<frequency>495.31</frequency>
			<frequencyMin>466.16</frequencyMin>
			<frequencyMax>517.24</frequencyMax>
		</note>
		<openHole>false</openHole>
		<openHole>false</openHole>
		<openHole>false</openHole>
		<openHole>false</openHole>
		<openHole>true</openHole>
		<openHole>false</openHole>
	</fingering>
	<fingering>
		<note>
			<name>C5</name>
			<frequency>520.24</frequency>
			<frequencyMin>491.04</frequencyMin>
			<frequencyMax>548</frequencyMax>
		</note>
		<openHole>false</openHole>
		<openHole>false</openHole>
		<openHole>false</openHole>
		<openHole>false</openHole>
		<openHole>true</openHole>
		<openHole>true</openHole>
	</fingering>
	<fingering>
		<note>
			<name>C#5</name>
			<frequency>558.22</frequency>
			<frequencyMin>523.25</frequencyMin>
			<frequencyMax>587.33</frequencyMax>
		</note>
		<openHole>false</openHole>
		<openHole>false</openHole>
		<openHole>false</openHole>
		<openHole>true</openHole>
		<openHole>false</openHole>
		<openHole>true</openHole>
	</fingering>
	<fingering>
		<note>
			<name>D5</name>
			<frequency>580.58</frequency>
			<frequencyMin>535.48</frequencyMin>
			<frequencyMax>611.56</frequencyMax>
		</note>
		<openHole>false</openHole>
		<openHole>false</openHole>
		<openHole>false</openHole>
		<openHole>true</openHole>
		<openHole>true</openHole>
		<openHole>true</openHole>
	</fingering>
	<fingering>
		<note>
			<name>D#5</name>
			<frequency>626.58</frequency>
			<frequencyMin>580.58</frequencyMin>
			<frequencyMax>663.07</frequencyMax>
		</note>
		<openHole>false</openHole>
		<openHole>false</openHole>
		<openHole>true</openHole>
		<openHole>false</openHole>
		<openHole>true</openHole>
		<openHole>true</openHole>
	</fingering>
	<fingering>
		<note>
			<name>E5</name>
			<frequency>649.8</frequency>
			<frequencyMin>618.67</frequencyMin>
			<frequencyMax>696.44</frequencyMax>
		</note>
		<openHole>false</openHole>
		<openHole>false</openHole>
		<openHole>true</openHole>
		<openHole>true</openHole>
		<openHole>true</openHole>
		<openHole>true</openHole>
	</fingering>
	<fingering>
		<note>
			<name>F5</name>
			<frequency>702.5</frequency>
			<frequencyMin>647.93</frequencyMin>
			<frequencyMax>763.88</frequencyMax>
		</note>
		<openHole>false</openHole>
		<openHole>true</openHole>
		<openHole>false</openHole>
		<openHole>true</openHole>
		<openHole>true</openHole>
		<openHole>true</openHole>
	</fingering>
	<fingering>
		<note>
			<name>F#5</name>
			<frequency>742.13</frequency>
			<frequencyMin>655.46</frequencyMin>
			<frequencyMax>825.83</frequencyMax>
		</note>
		<openHole>false</openHole>
		<openHole>true</openHole>
		<openHole>true</openHole>
		<openHole>true</openHole>
		<openHole>true</openHole>
		<openHole>true</openHole>
	</fingering>
	<fingering>
		<note>
			<name>G5</name>
			<frequency>825.83</frequency>
			<frequencyMin>727.28</frequencyMin>
			<frequencyMax>911.03</frequencyMax>
		</note>
		<openHole>true</openHole>
		<openHole>true</openHole>
		<openHole>false</openHole>
		<openHole>true</openHole>
		<openHole>true</openHole>
		<openHole>true</openHole>
	</fingering>
	<fingering>
		<note>
			<name>G#5</name>
			<frequency>845.13</frequency>
			<frequencyMin>770.52</frequencyMin>
			<frequencyMax>976.42</frequencyMax>
		</note>
		<openHole>true</openHole>
		<openHole>true</openHole>
		<openHole>true</openHole>
		<openHole>true</openHole>
		<openHole>true</openHole>
		<openHole>true</openHole>
	</fingering>
	<fingering>
		<note>
			<name>A5</name>
			<frequency>880.00</frequency>
			<frequencyMin>752.92</frequencyMin>
			<frequencyMax>954.12</frequencyMax>
		</note>
		<openHole>true</openHole>
		<openHole>true</openHole>
		<openHole>false</openHole>
		<openHole>false</openHole>
		<openHole>false</openHole>
		<openHole>false</openHole>
	</fingering>
	<fingering>
		<note>
			<name>A#5</name>
			<frequency>929.64</frequency>
			<frequencyMin>890.23</frequencyMin>
			<frequencyMax>1005.03</frequencyMax>
		</note>
		<openHole>true</openHole>
		<openHole>true</openHole>
		<openHole>false</openHole>
		<openHole>false</openHole>
		<openHole>false</openHole>
		<openHole>true</openHole>
	</fingering>
</wit:tuning>
