<?xml version="1.0" encoding="utf-8"?>
<wit:tuning xmlns:xsi="http://www.w3.org/2001/XMLSchema-instance"
         xmlns:wit="http://www.wwidesigner.com/Tuning"
         xsi:schemaLocation="http://www.wwidesigner.com/Tuning ../Tuning.xsd ">

	<name>BP8 In Progress</name>
	<comment>6-hole PVC whistle, high D, actual tuning while under construction</comment>
	<numberOfHoles>6</numberOfHoles>
	<fingering>
		<note>
			<name>low D</name>
			<frequency>587</frequency>
			<frequencyMin>568</frequencyMin>
			<frequencyMax>585</frequencyMax>
		</note>
		<openHole>false</openHole><openHole>false</openHole><openHole>false</openHole>
		<openHole>false</openHole><openHole>false</openHole><openHole>false</openHole>
	</fingering>
	<fingering>
		<note>
			<name>E</name>
			<frequency>652</frequency>
			<frequencyMin>630</frequencyMin>
			<frequencyMax>653</frequencyMax>
		</note>
		<openHole>false</openHole><openHole>false</openHole><openHole>false</openHole>
		<openHole>false</openHole><openHole>false</openHole><openHole>true</openHole>
	</fingering>
	<fingering>
		<note>
			<name>F#</name>
			<frequency>719</frequency>
			<frequencyMin>690</frequencyMin>
			<frequencyMax>728</frequencyMax>
		</note>
		<openHole>false</openHole><openHole>false</openHole><openHole>false</openHole>
		<openHole>false</openHole><openHole>true</openHole><openHole>true</openHole>
	</fingering>
	<fingering>
		<note>
		<name>G</name>
			<frequency>764</frequency>
			<frequencyMin>733</frequencyMin>
			<frequencyMax>774</frequencyMax>
		</note>
		<openHole>false</openHole><openHole>false</openHole><openHole>false</openHole>
		<openHole>true</openHole><openHole>true</openHole><openHole>true</openHole>
	</fingering>
	<fingering>
		<note>
		<name>A</name>
			<frequency>861</frequency>
			<frequencyMin>825</frequencyMin>
			<frequencyMax>878</frequencyMax>
		</note>
		<openHole>false</openHole><openHole>false</openHole><openHole>true</openHole>
		<openHole>true</openHole><openHole>true</openHole><openHole>true</openHole>
	</fingering>
	<fingering>
		<note>
		<name>B</name>
			<frequency>954</frequency>
			<frequencyMin>895</frequencyMin>
			<frequencyMax>978</frequencyMax>
		</note>
		<openHole>false</openHole><openHole>true</openHole><openHole>true</openHole>
		<openHole>true</openHole><openHole>true</openHole><openHole>true</openHole>
	</fingering>
	<fingering>
		<note>
		<name>C-nat</name>
			<frequency>999</frequency>
			<frequencyMin>939</frequencyMin>
			<frequencyMax>1027</frequencyMax>
		</note>
		<openHole>true</openHole><openHole>false</openHole><openHole>false</openHole>
		<openHole>true</openHole><openHole>true</openHole><openHole>true</openHole>
	</fingering>
	<fingering>
		<note>
			<name>C#</name>
			<frequency>1060</frequency>
			<frequencyMin>1000</frequencyMin>
			<frequencyMax>1092</frequencyMax>
		</note>
		<openHole>true</openHole><openHole>true</openHole><openHole>true</openHole>
		<openHole>true</openHole><openHole>true</openHole><openHole>true</openHole>
	</fingering>
	<fingering>
		<note>
			<name>D</name>
			<frequency>1162</frequency>
			<frequencyMin>1116</frequencyMin>
			<frequencyMax>1191</frequencyMax>
		</note>
		<openHole>true</openHole><openHole>false</openHole><openHole>false</openHole>
		<openHole>false</openHole><openHole>false</openHole><openHole>false</openHole>
	</fingering>
	<fingering>
		<note>
			<name>E</name>
			<frequency>1295</frequency>
			<frequencyMin>1238</frequencyMin>
			<frequencyMax>1315</frequencyMax>
		</note>
		<openHole>false</openHole><openHole>false</openHole><openHole>false</openHole>
		<openHole>false</openHole><openHole>false</openHole><openHole>true</openHole>
	</fingering>
	<fingering>
		<note>
			<name>F#</name>
			<frequency>1420</frequency>
			<frequencyMin>1366</frequencyMin>
			<frequencyMax>1460</frequencyMax>
		</note>
		<openHole>false</openHole><openHole>false</openHole><openHole>false</openHole>
		<openHole>false</openHole><openHole>true</openHole><openHole>true</openHole>
	</fingering>
	<fingering>
		<note>
		<name>G</name>
			<frequency>1510</frequency>
			<frequencyMin>1456</frequencyMin>
			<frequencyMax>1560</frequencyMax>
		</note>
		<openHole>false</openHole><openHole>false</openHole><openHole>false</openHole>
		<openHole>true</openHole><openHole>true</openHole><openHole>true</openHole>
	</fingering>
	<fingering>
		<note>
			<name>A</name>
			<frequency>1689</frequency>
			<frequencyMin>1648</frequencyMin>
			<frequencyMax>1761</frequencyMax>
		</note>
		<openHole>false</openHole><openHole>false</openHole><openHole>true</openHole>
		<openHole>true</openHole><openHole>true</openHole><openHole>true</openHole>
	</fingering>
	<fingering>
		<note>
		<name>B</name>
			<frequency>1863</frequency>
			<frequencyMin>1830</frequencyMin>
			<frequencyMax>1940</frequencyMax>
		</note>
		<openHole>false</openHole><openHole>true</openHole><openHole>true</openHole>
		<openHole>true</openHole><openHole>true</openHole><openHole>true</openHole>
	</fingering>
	<fingering>
		<note>
			<name>hi C-nat</name>
			<frequency>1903</frequency>
			<frequencyMin>1901</frequencyMin>
			<frequencyMax>1937</frequencyMax>
		</note>
		<openHole>true</openHole><openHole>false</openHole><openHole>true</openHole>
		<openHole>true</openHole><openHole>true</openHole><openHole>true</openHole>
	</fingering>
	<fingering>
		<note>
			<name>C#</name>
			<frequency>2063</frequency>
			<frequencyMin>2031</frequencyMin>
			<frequencyMax>2112</frequencyMax>
		</note>
		<openHole>true</openHole><openHole>true</openHole><openHole>true</openHole>
		<openHole>true</openHole><openHole>true</openHole><openHole>true</openHole>
	</fingering>
	<fingering>
		<note>
			<name>high D</name>
			<frequency>2345</frequency>
			<frequencyMin>2332</frequencyMin>
			<frequencyMax>2408</frequencyMax>
		</note>
		<openHole>true</openHole><openHole>false</openHole><openHole>false</openHole>
		<openHole>false</openHole><openHole>false</openHole><openHole>false</openHole>
	</fingering>
	<fingering>
		<note>
			<name>pre-D</name>
			<frequencyMin>840</frequencyMin>
			<frequencyMax>857</frequencyMax>
		</note>
		<openHole>true</openHole><openHole>false</openHole><openHole>false</openHole>
		<openHole>false</openHole><openHole>false</openHole><openHole>false</openHole>
	</fingering>

</wit:tuning>