<?xml version="1.0" encoding="utf-8"?>
<wit:tuning xmlns:xsi="http://www.w3.org/2001/XMLSchema-instance"
         xmlns:wit="http://www.wwidesigner.com/Tuning"
         xsi:schemaLocation="http://www.wwidesigner.com/Tuning ../Tuning.xsd ">

	<name>Alto Bb JI Tuning</name>
	<comment>6-hole whistle, alto Bb, Just Intonation tuning.</comment>
	<numberOfHoles>6</numberOfHoles>
	<fingering>
		<note>
			<name>Bb</name>
			<frequency>466.16</frequency>
		</note>
		<openHole>false</openHole><openHole>false</openHole><openHole>false</openHole>
		<openHole>false</openHole><openHole>false</openHole><openHole>false</openHole>
	</fingering>
	<fingering>
		<note>
			<name>C</name>
			<frequency>524.43</frequency>
		</note>
		<openHole>false</openHole><openHole>false</openHole><openHole>false</openHole>
		<openHole>false</openHole><openHole>false</openHole><openHole>true</openHole>
	</fingering>
	<fingering>
		<note>
			<name>D</name>
			<frequency>582.70</frequency>
		</note>
		<openHole>false</openHole><openHole>false</openHole><openHole>false</openHole>
		<openHole>false</openHole><openHole>true</openHole><openHole>true</openHole>
	</fingering>
	<fingering>
		<note>
			<name>Eb</name>
			<frequency>621.55</frequency>
		</note>
		<openHole>false</openHole><openHole>false</openHole><openHole>false</openHole>
		<openHole>true</openHole><openHole>true</openHole><openHole>true</openHole>
	</fingering>
	<fingering>
		<note>
			<name>F</name>
			<frequency>699.25</frequency>
		</note>
		<openHole>false</openHole><openHole>false</openHole><openHole>true</openHole>
		<openHole>true</openHole><openHole>true</openHole><openHole>true</openHole>
	</fingering>
	<fingering>
		<note>
			<name>G</name>
			<frequency>776.94</frequency>
		</note>
		<openHole>false</openHole><openHole>true</openHole><openHole>true</openHole>
		<openHole>true</openHole><openHole>true</openHole><openHole>true</openHole>
	</fingering>
	<fingering>
		<note>
			<name>Ab</name>
			<frequency>828.74</frequency>
		</note>
		<openHole>true</openHole><openHole>false</openHole><openHole>false</openHole>
		<openHole>true</openHole><openHole>true</openHole><openHole>true</openHole>
	</fingering>
	<fingering>
		<note>
			<name>A</name>
			<frequency>874.06</frequency>
		</note>
		<openHole>true</openHole><openHole>true</openHole><openHole>true</openHole>
		<openHole>true</openHole><openHole>true</openHole><openHole>true</openHole>
	</fingering>
	<fingering>
		<note>
			<name>Bb</name>
			<frequency>932.33</frequency>
		</note>
		<openHole>true</openHole><openHole>false</openHole><openHole>false</openHole>
		<openHole>false</openHole><openHole>false</openHole><openHole>false</openHole>
	</fingering>
	<fingering>
		<note>
			<name>C</name>
			<frequency>1048.9</frequency>
		</note>
		<openHole>false</openHole><openHole>false</openHole><openHole>false</openHole>
		<openHole>false</openHole><openHole>false</openHole><openHole>true</openHole>
	</fingering>
	<fingering>
		<note>
			<name>D</name>
			<frequency>1165.4</frequency>
		</note>
		<openHole>false</openHole><openHole>false</openHole><openHole>false</openHole>
		<openHole>false</openHole><openHole>true</openHole><openHole>true</openHole>
	</fingering>
	<fingering>
		<note>
			<name>Eb</name>
			<frequency>1243.1</frequency>
		</note>
		<openHole>false</openHole><openHole>false</openHole><openHole>false</openHole>
		<openHole>true</openHole><openHole>true</openHole><openHole>true</openHole>
	</fingering>
	<fingering>
		<note>
			<name>F</name>
			<frequency>1398.5</frequency>
		</note>
		<openHole>false</openHole><openHole>false</openHole><openHole>true</openHole>
		<openHole>true</openHole><openHole>true</openHole><openHole>true</openHole>
	</fingering>
	<fingering>
		<note>
			<name>G</name>
			<frequency>1553.9</frequency>
		</note>
		<openHole>false</openHole><openHole>true</openHole><openHole>true</openHole>
		<openHole>true</openHole><openHole>true</openHole><openHole>true</openHole>
	</fingering>
	<fingering>
		<note>
			<name>Ab</name>
			<frequency>1657.5</frequency>
		</note>
		<openHole>true</openHole><openHole>false</openHole><openHole>true</openHole>
		<openHole>false</openHole><openHole>false</openHole><openHole>false</openHole>
	</fingering>
	<fingering>
		<note>
			<name>A</name>
			<frequency>1748.1</frequency>
		</note>
		<openHole>true</openHole><openHole>true</openHole><openHole>true</openHole>
		<openHole>true</openHole><openHole>true</openHole><openHole>true</openHole>
	</fingering>
	<fingering>
		<note>
			<name>Bb</name>
			<frequency>1864.7</frequency>
		</note>
		<openHole>true</openHole><openHole>false</openHole><openHole>false</openHole>
		<openHole>true</openHole><openHole>true</openHole><openHole>true</openHole>
	</fingering>
</wit:tuning>
