<?xml version="1.0" encoding="UTF-8"?>
<wit:tuning xmlns:wit="http://www.wwidesigner.com/Tuning"
	xmlns:xsi="http://www.w3.org/2001/XMLSchema-instance"
	xsi:schemaLocation="http://www.wwidesigner.com/Tuning ../../../../../main/com/wwidesigner/note/bind/Tuning.xsd ">
	<name>D minor ET,6 hole NAF tuning</name>
	<comment>D minor equal temperament tuning for 6-hole NAF</comment>
	<numberOfHoles>6</numberOfHoles>
	<fingering>
		<note>
			<name>D4</name>
			<frequency>293.66</frequency>
		</note>
		<openHole>false</openHole>
		<openHole>false</openHole>
		<openHole>false</openHole>
		<openHole>false</openHole>
		<openHole>false</openHole>
		<openHole>false</openHole>
	</fingering>
	<fingering>
		<note>
			<name>F4</name>
			<frequency>349.23</frequency>
		</note>
		<openHole>false</openHole>
		<openHole>false</openHole>
		<openHole>false</openHole>
		<openHole>false</openHole>
		<openHole>false</openHole>
		<openHole>true</openHole>
	</fingering>
 	<fingering>
		<note>
			<name>F#4</name>
			<frequency>369.99</frequency>
		</note>
		<openHole>false</openHole>
		<openHole>false</openHole>
		<openHole>false</openHole>
		<openHole>false</openHole>
		<openHole>true</openHole>
		<openHole>false</openHole>
	</fingering>  
	<fingering>
		<note>
			<name>G4</name>
			<frequency>392.00</frequency>
		</note>
		<openHole>false</openHole>
		<openHole>false</openHole>
		<openHole>false</openHole>
		<openHole>false</openHole>
		<openHole>true</openHole>
		<openHole>true</openHole>
	</fingering>
	<fingering>
		<note>
			<name>G#4</name>
			<frequency>415.30</frequency>
		</note>
		<openHole>false</openHole>
		<openHole>false</openHole>
		<openHole>false</openHole>
		<openHole>true</openHole>
		<openHole>false</openHole>
		<openHole>true</openHole>
	</fingering>   
	<fingering>
		<note>
			<name>A4</name>
			<frequency>440.00</frequency>
		</note>
		<openHole>false</openHole>
		<openHole>false</openHole>
		<openHole>false</openHole>
		<openHole>true</openHole>
		<openHole>true</openHole>
		<openHole>true</openHole>
	</fingering>
	<fingering>
		<note>
			<name>A#4</name>
			<frequency>466.16</frequency>
		</note>
		<openHole>false</openHole>
		<openHole>false</openHole>
		<openHole>true</openHole>
		<openHole>false</openHole>
		<openHole>true</openHole>
		<openHole>true</openHole>
	</fingering>
	<fingering>
		<note>
			<name>B4</name>
			<frequency>493.88</frequency>
		</note>
		<openHole>false</openHole>
		<openHole>false</openHole>
		<openHole>true</openHole>
		<openHole>true</openHole>
		<openHole>true</openHole>
		<openHole>true</openHole>
	</fingering>  
	<fingering>
		<note>
			<name>C5</name>
			<frequency>523.25</frequency>
		</note>
		<openHole>false</openHole>
		<openHole>true</openHole>
		<openHole>false</openHole>
		<openHole>true</openHole>
		<openHole>true</openHole>
		<openHole>true</openHole>
	</fingering>
	<fingering>
		<note>
			<name>C#5</name>
			<frequency>554.37</frequency>
		</note>
		<openHole>false</openHole>
		<openHole>true</openHole>
		<openHole>true</openHole>
		<openHole>true</openHole>
		<openHole>true</openHole>
		<openHole>true</openHole>
	</fingering>  
	<fingering>
		<note>
			<name>D5</name>
			<frequency>587.33</frequency>
		</note>
		<openHole>true</openHole>
		<openHole>true</openHole>
		<openHole>false</openHole>
		<openHole>true</openHole>
		<openHole>true</openHole>
		<openHole>true</openHole>
	</fingering>
<!--	<fingering>
		<note>
			<name>D#5</name>
			<frequency>622.25</frequency>
		</note>
		<openHole>true</openHole>
		<openHole>true</openHole>
		<openHole>true</openHole>
		<openHole>true</openHole>
		<openHole>true</openHole>
		<openHole>true</openHole>
	</fingering>  -->
<!--	<fingering>
		<note>
			<name>D#5</name>
			<frequency>622.25</frequency>
		</note>
		<openHole>false</openHole>
		<openHole>true</openHole>
		<openHole>false</openHole>
		<openHole>false</openHole>
		<openHole>false</openHole>
		<openHole>false</openHole>
	</fingering>  -->
	<fingering>
		<note>
			<name>E5</name>
			<frequency>659.26</frequency>
		</note>
		<openHole>true</openHole>
		<openHole>true</openHole>
		<openHole>false</openHole>
		<openHole>false</openHole>
		<openHole>false</openHole>
		<openHole>false</openHole>
	</fingering>  
	<fingering>
		<note>
			<name>F5</name>
			<frequency>698.46</frequency>
		</note>
		<openHole>true</openHole>
		<openHole>true</openHole>
		<openHole>false</openHole>
		<openHole>false</openHole>
		<openHole>false</openHole>
		<openHole>true</openHole>
	</fingering> 
</wit:tuning>