<?xml version="1.0" encoding="utf-8"?>
<wit:tuning xmlns:xsi="http://www.w3.org/2001/XMLSchema-instance"
         xmlns:wit="http://www.wwidesigner.com/Tuning"
         xsi:schemaLocation="http://www.wwidesigner.com/Tuning ../Tuning.xsd ">
	<name>Alto A JI Tuning</name>
	<comment>6-hole whistle, alto A, Just Intonation tuning.</comment>
	<numberOfHoles>6</numberOfHoles>
	<fingering>
		<note>
			<name>low A</name>
			<frequency>440.00</frequency>
		</note>
		<openHole>false</openHole><openHole>false</openHole><openHole>false</openHole>
		<openHole>false</openHole><openHole>false</openHole><openHole>false</openHole>
	</fingering>
	<fingering>
		<note>
			<name>B</name>
			<frequency>495.00</frequency>
		</note>
		<openHole>false</openHole><openHole>false</openHole><openHole>false</openHole>
		<openHole>false</openHole><openHole>false</openHole><openHole>true</openHole>
	</fingering>
	<fingering>
		<note>
			<name>C#</name>
			<frequency>550.00</frequency>
		</note>
		<openHole>false</openHole><openHole>false</openHole><openHole>false</openHole>
		<openHole>false</openHole><openHole>true</openHole><openHole>true</openHole>
	</fingering>
	<fingering>
		<note>
			<name>D</name>
			<frequency>586.67</frequency>
		</note>
		<openHole>false</openHole><openHole>false</openHole><openHole>false</openHole>
		<openHole>true</openHole><openHole>true</openHole><openHole>true</openHole>
	</fingering>
	<fingering>
		<note>
			<name>E</name>
			<frequency>660.00</frequency>
		</note>
		<openHole>false</openHole><openHole>false</openHole><openHole>true</openHole>
		<openHole>true</openHole><openHole>true</openHole><openHole>true</openHole>
	</fingering>
	<fingering>
		<note>
			<name>F#</name>
			<frequency>733.33</frequency>
		</note>
		<openHole>false</openHole><openHole>true</openHole><openHole>true</openHole>
		<openHole>true</openHole><openHole>true</openHole><openHole>true</openHole>
	</fingering>
	<fingering>
		<note>
			<name>G-nat</name>
			<frequency>782.22</frequency>
		</note>
		<openHole>true</openHole><openHole>false</openHole><openHole>false</openHole>
		<openHole>true</openHole><openHole>true</openHole><openHole>true</openHole>
	</fingering>
	<fingering>
		<note>
			<name>G#</name>
			<frequency>825.00</frequency>
		</note>
		<openHole>true</openHole><openHole>true</openHole><openHole>true</openHole>
		<openHole>true</openHole><openHole>true</openHole><openHole>true</openHole>
	</fingering>
	<fingering>
		<note>
			<name>A</name>
			<frequency>880.00</frequency>
		</note>
		<openHole>true</openHole><openHole>false</openHole><openHole>false</openHole>
		<openHole>false</openHole><openHole>false</openHole><openHole>false</openHole>
	</fingering>
	<fingering>
		<note>
			<name>B</name>
			<frequency>990.00</frequency>
		</note>
		<openHole>false</openHole><openHole>false</openHole><openHole>false</openHole>
		<openHole>false</openHole><openHole>false</openHole><openHole>true</openHole>
	</fingering>
	<fingering>
		<note>
			<name>C#</name>
			<frequency>1100.0</frequency>
		</note>
		<openHole>false</openHole><openHole>false</openHole><openHole>false</openHole>
		<openHole>false</openHole><openHole>true</openHole><openHole>true</openHole>
	</fingering>
	<fingering>
		<note>
			<name>D</name>
			<frequency>1173.3</frequency>
		</note>
		<openHole>false</openHole><openHole>false</openHole><openHole>false</openHole>
		<openHole>true</openHole><openHole>true</openHole><openHole>true</openHole>
	</fingering>
	<fingering>
		<note>
			<name>E</name>
			<frequency>1320.0</frequency>
		</note>
		<openHole>false</openHole><openHole>false</openHole><openHole>true</openHole>
		<openHole>true</openHole><openHole>true</openHole><openHole>true</openHole>
	</fingering>
	<fingering>
		<note>
			<name>F#</name>
			<frequency>1466.7</frequency>
		</note>
		<openHole>false</openHole><openHole>true</openHole><openHole>true</openHole>
		<openHole>true</openHole><openHole>true</openHole><openHole>true</openHole>
	</fingering>
	<fingering>
		<note>
			<name>G-nat</name>
			<frequency>1564.4</frequency>
		</note>
		<openHole>true</openHole><openHole>false</openHole><openHole>true</openHole>
		<openHole>false</openHole><openHole>false</openHole><openHole>false</openHole>
	</fingering>
	<fingering>
		<note>
			<name>G#</name>
			<frequency>1650.0</frequency>
		</note>
		<openHole>true</openHole><openHole>true</openHole><openHole>true</openHole>
		<openHole>true</openHole><openHole>true</openHole><openHole>true</openHole>
	</fingering>
	<fingering>
		<note>
			<name>A</name>
			<frequency>1760.0</frequency>
		</note>
		<openHole>true</openHole><openHole>false</openHole><openHole>false</openHole>
		<openHole>true</openHole><openHole>true</openHole><openHole>true</openHole>
	</fingering>

</wit:tuning>